{"aliases":[],"authors":["Example Studio"],"consent":{"vendors":["example-vendor"]},"description":"Loose ink line with flat watercolour washes and a muted harbour palette.","display_name":"Harbor Ink","id":"urn:uuid:5a1e0000-0000-4000-8000-0000000000a1","influences":[],"kind":"original","links":[],"rights":{"holder":"Example Studio","license":"LicenseRef-example-style"}}